{"assessment_id":"urn:preflightops:assessment:sha256:3642cd0bbe87988b13748040603206118ae99d9c127d077cb8a9949ab055ad60","blockers":[],"change_id":"CHG-2026-0042","compatibility":{"adapter_version":"1.0","legacy_output_preserved":false,"source_contract":"native-assessment-v1"},"context":{"actor":{"id":"release-bot","type":"automation"},"commit":"aaaaaaaaaaaaaaaaaaaaaaaaaaaaaaaaaaaaaaaa","pipeline":{"name":"preflight","url":"https://github.example.test/acme/payments-api/actions/runs/4242"},"pull_request":"87","repository":"acme/payments-api","run":{"attempt":1,"id":"4242"}},"controls":[{"control_id":"rollback-plan","evidence_ids":["urn:preflightops:evidence:sha256:c4e32b34b2321bba0579d8bcd8c858cef62e3336ecee875b04d41329ca64f405"],"execution_id":"urn:preflightops:control:sha256:202cab4a4ea34b00ee896041bd2c20ef7cf63ecb2c8c48eac88ff9cfd340e942","risk_points":0,"source":"change-request-validator","status":"PASS","summary":"Rollback plan is present and testable."}],"data":{"classification":"internal","content_embedded":false,"input_hash_profile":"caller-supplied-sha256-v1","redaction_profile":"preflightops-assessment-metadata-v1"},"errors":[],"evidence":[{"collected_at":"2026-08-31T12:00:00Z","control_id":"rollback-plan","evidence_id":"urn:preflightops:evidence:sha256:c4e32b34b2321bba0579d8bcd8c858cef62e3336ecee875b04d41329ca64f405","freshness":"FRESH","hash":{"algorithm":"sha256","value":"eeeeeeeeeeeeeeeeeeeeeeeeeeeeeeeeeeeeeeeeeeeeeeeeeeeeeeeeeeeeeeee"},"kind":"control-result","links":[],"source":"change-request-validator","valid_until":"2026-08-31T13:00:00Z"}],"evidence_links":["https://evidence.example.test/runs/4242"],"human_decision":{"actor_id":null,"authority":"external_cab_or_change_management","decided_at":null,"decision":null,"rationale_code":null,"status":"NOT_RECORDED"},"inputs":[{"hash":{"algorithm":"sha256","profile":"caller-supplied-sha256-v1","value":"cccccccccccccccccccccccccccccccccccccccccccccccccccccccccccccccc"},"name":"change-request"},{"hash":{"algorithm":"sha256","profile":"caller-supplied-sha256-v1","value":"dddddddddddddddddddddddddddddddddddddddddddddddddddddddddddddddd"},"name":"service-catalog"}],"integrity":{"algorithm":"sha256","canonicalization":"preflightops-canonical-json-v1","value":"3642cd0bbe87988b13748040603206118ae99d9c127d077cb8a9949ab055ad60"},"passed_controls":["rollback-plan"],"policy":{"hash":{"algorithm":"sha256","value":"bbbbbbbbbbbbbbbbbbbbbbbbbbbbbbbbbbbbbbbbbbbbbbbbbbbbbbbbbbbbbbbb"},"name":"production","version":"2.1.0"},"producer":{"name":"PreflightOps","version":"0.4.2"},"recommendation":{"action":"PROCEED","basis":"technical_only","grants_approval":false,"summary":"Proceed to an authorized human review."},"schema_version":"1.0","scores":{"confidence":{"basis":"fresh-digest-pinned-control-observations-v1","level":"HIGH","value":100},"risk":{"level":"LOW","value":20}},"timestamp":"2026-08-31T12:00:00Z","verdict":"READY_FOR_HUMAN_REVIEW","waivers":[],"warnings":[]}

